{
    "description": "Regression for three dashboards",
    "name": "12.Regression_three_dashboards",
    "tableau-snapshot": {
        "content": {
            "filters": true,
            "fullColumns": true,
            "image": true,
            "parameters": true,
            "summaryColumns": true,
            "summaryData": true,
            "worksheets": true
        },
        "image": "resources/snapshot-Superstore_16045654715070-Shipping.png",
        "name": "Shipping",
        "parameters": [
            {
                "name": "New Quota",
                "type": "integer",
                "value": {
                    "formattedValue": "$500K",
                    "value": 500000
                }
            },
            {
                "name": "Churn Rate",
                "type": "float",
                "value": {
                    "formattedValue": "6.40%",
                    "value": 0.064
                }
            },
            {
                "name": "Sort by",
                "type": "string",
                "value": {
                    "formattedValue": "Names",
                    "value": "Names"
                }
            },
            {
                "name": "Commission Rate",
                "type": "float",
                "value": {
                    "formattedValue": "18.4%",
                    "value": 18.400000000000002
                }
            },
            {
                "name": "New Business Growth",
                "type": "float",
                "value": {
                    "formattedValue": "60%",
                    "value": 0.6
                }
            },
            {
                "name": "Base Salary",
                "type": "integer",
                "value": {
                    "formattedValue": "50,000",
                    "value": 50000
                }
            }
        ],
        "timestamp": 1604949673025,
        "uniqueName": "Superstore_16045654715070-Shipping",
        "url": "https://10ax.online.tableau.com/t/kinesisbetaonlinesite/views/Superstore_16045654715070/Shipping",
        "urlWithSelmerTokens": "{{TABLEAU_URL}}/t/{{TABLEAU_SITE}}/views/Superstore_16045654715070/Shipping",
        "worksheets": [
            {
                "columns": {
                    "summary": [
                        {
                            "dataType": "integer",
                            "index": 0,
                            "name": "YEAR(Order Date)"
                        },
                        {
                            "dataType": "datetime",
                            "index": 1,
                            "name": "WEEK(Order Date)"
                        },
                        {
                            "dataType": "string",
                            "index": 2,
                            "name": "Ship Status"
                        },
                        {
                            "dataType": "integer",
                            "index": 3,
                            "name": "SUM(Number of Records)"
                        }
                    ],
                    "underlying": [
                        {
                            "dataType": "integer",
                            "index": 0,
                            "name": "YEAR(Order Date)"
                        },
                        {
                            "dataType": "datetime",
                            "index": 1,
                            "name": "WEEK(Order Date)"
                        },
                        {
                            "dataType": "string",
                            "index": 2,
                            "name": "Ship Status"
                        },
                        {
                            "dataType": "string",
                            "index": 3,
                            "name": "Region"
                        },
                        {
                            "dataType": "string",
                            "index": 4,
                            "name": "Ship Mode"
                        },
                        {
                            "dataType": "date",
                            "index": 5,
                            "name": "Order Date"
                        },
                        {
                            "dataType": "date",
                            "index": 6,
                            "name": "Ship Date"
                        },
                        {
                            "dataType": "integer",
                            "index": 7,
                            "name": "Days to Ship Actual"
                        },
                        {
                            "dataType": "integer",
                            "index": 8,
                            "name": "Days to Ship Scheduled"
                        },
                        {
                            "dataType": "integer",
                            "index": 9,
                            "name": "Number of Records"
                        }
                    ]
                },
                "data": {
                    "summary": [
                        {
                            "SUM(Number of Records)": {
                                "formattedValue": "61",
                                "value": "61"
                            },
                            "Ship Status": {
                                "formattedValue": "Shipped Early",
                                "value": "Shipped Early"
                            },
                            "WEEK(Order Date)": {
                                "formattedValue": "29 September 2019",
                                "value": "2019-09-29 00:00:00"
                            },
                            "YEAR(Order Date)": {
                                "formattedValue": "2019",
                                "value": "2019"
                            }
                        },
                        {
                            "SUM(Number of Records)": {
                                "formattedValue": "35",
                                "value": "35"
                            },
                            "Ship Status": {
                                "formattedValue": "Shipped Early",
                                "value": "Shipped Early"
                            },
                            "WEEK(Order Date)": {
                                "formattedValue": "6 October 2019",
                                "value": "2019-10-06 00:00:00"
                            },
                            "YEAR(Order Date)": {
                                "formattedValue": "2019",
                                "value": "2019"
                            }
                        },
                        {
                            "SUM(Number of Records)": {
                                "formattedValue": "27",
                                "value": "27"
                            },
                            "Ship Status": {
                                "formattedValue": "Shipped Early",
                                "value": "Shipped Early"
                            },
                            "WEEK(Order Date)": {
                                "formattedValue": "13 October 2019",
                                "value": "2019-10-13 00:00:00"
                            },
                            "YEAR(Order Date)": {
                                "formattedValue": "2019",
                                "value": "2019"
                            }
                        },
                        {
                            "SUM(Number of Records)": {
                                "formattedValue": "28",
                                "value": "28"
                            },
                            "Ship Status": {
                                "formattedValue": "Shipped Early",
                                "value": "Shipped Early"
                            },
                            "WEEK(Order Date)": {
                                "formattedValue": "20 October 2019",
                                "value": "2019-10-20 00:00:00"
                            },
                            "YEAR(Order Date)": {
                                "formattedValue": "2019",
                                "value": "2019"
                            }
                        },
                        {
                            "SUM(Number of Records)": {
                                "formattedValue": "32",
                                "value": "32"
                            },
                            "Ship Status": {
                                "formattedValue": "Shipped Early",
                                "value": "Shipped Early"
                            },
                            "WEEK(Order Date)": {
                                "formattedValue": "27 October 2019",
                                "value": "2019-10-27 00:00:00"
                            },
                            "YEAR(Order Date)": {
                                "formattedValue": "2019",
                                "value": "2019"
                            }
                        },
                        {
                            "SUM(Number of Records)": {
                                "formattedValue": "45",
                                "value": "45"
                            },
                            "Ship Status": {
                                "formattedValue": "Shipped Early",
                                "value": "Shipped Early"
                            },
                            "WEEK(Order Date)": {
                                "formattedValue": "3 November 2019",
                                "value": "2019-11-03 00:00:00"
                            },
                            "YEAR(Order Date)": {
                                "formattedValue": "2019",
                                "value": "2019"
                            }
                        },
                        {
                            "SUM(Number of Records)": {
                                "formattedValue": "37",
                                "value": "37"
                            },
                            "Ship Status": {
                                "formattedValue": "Shipped Early",
                                "value": "Shipped Early"
                            },
                            "WEEK(Order Date)": {
                                "formattedValue": "10 November 2019",
                                "value": "2019-11-10 00:00:00"
                            },
                            "YEAR(Order Date)": {
                                "formattedValue": "2019",
                                "value": "2019"
                            }
                        },
                        {
                            "SUM(Number of Records)": {
                                "formattedValue": "73",
                                "value": "73"
                            },
                            "Ship Status": {
                                "formattedValue": "Shipped Early",
                                "value": "Shipped Early"
                            },
                            "WEEK(Order Date)": {
                                "formattedValue": "17 November 2019",
                                "value": "2019-11-17 00:00:00"
                            },
                            "YEAR(Order Date)": {
                                "formattedValue": "2019",
                                "value": "2019"
                            }
                        },
                        {
                            "SUM(Number of Records)": {
                                "formattedValue": "52",
                                "value": "52"
                            },
                            "Ship Status": {
                                "formattedValue": "Shipped Early",
                                "value": "Shipped Early"
                            },
                            "WEEK(Order Date)": {
                                "formattedValue": "24 November 2019",
                                "value": "2019-11-24 00:00:00"
                            },
                            "YEAR(Order Date)": {
                                "formattedValue": "2019",
                                "value": "2019"
                            }
                        },
                        {
                            "SUM(Number of Records)": {
                                "formattedValue": "70",
                                "value": "70"
                            },
                            "Ship Status": {
                                "formattedValue": "Shipped Early",
                                "value": "Shipped Early"
                            },
                            "WEEK(Order Date)": {
                                "formattedValue": "1 December 2019",
                                "value": "2019-12-01 00:00:00"
                            },
                            "YEAR(Order Date)": {
                                "formattedValue": "2019",
                                "value": "2019"
                            }
                        },
                        {
                            "SUM(Number of Records)": {
                                "formattedValue": "65",
                                "value": "65"
                            },
                            "Ship Status": {
                                "formattedValue": "Shipped Early",
                                "value": "Shipped Early"
                            },
                            "WEEK(Order Date)": {
                                "formattedValue": "8 December 2019",
                                "value": "2019-12-08 00:00:00"
                            },
                            "YEAR(Order Date)": {
                                "formattedValue": "2019",
                                "value": "2019"
                            }
                        },
                        {
                            "SUM(Number of Records)": {
                                "formattedValue": "26",
                                "value": "26"
                            },
                            "Ship Status": {
                                "formattedValue": "Shipped Early",
                                "value": "Shipped Early"
                            },
                            "WEEK(Order Date)": {
                                "formattedValue": "15 December 2019",
                                "value": "2019-12-15 00:00:00"
                            },
                            "YEAR(Order Date)": {
                                "formattedValue": "2019",
                                "value": "2019"
                            }
                        },
                        {
                            "SUM(Number of Records)": {
                                "formattedValue": "53",
                                "value": "53"
                            },
                            "Ship Status": {
                                "formattedValue": "Shipped Early",
                                "value": "Shipped Early"
                            },
                            "WEEK(Order Date)": {
                                "formattedValue": "22 December 2019",
                                "value": "2019-12-22 00:00:00"
                            },
                            "YEAR(Order Date)": {
                                "formattedValue": "2019",
                                "value": "2019"
                            }
                        },
                        {
                            "SUM(Number of Records)": {
                                "formattedValue": "14",
                                "value": "14"
                            },
                            "Ship Status": {
                                "formattedValue": "Shipped Early",
                                "value": "Shipped Early"
                            },
                            "WEEK(Order Date)": {
                                "formattedValue": "29 December 2019",
                                "value": "2019-12-29 00:00:00"
                            },
                            "YEAR(Order Date)": {
                                "formattedValue": "2019",
                                "value": "2019"
                            }
                        },
                        {
                            "SUM(Number of Records)": {
                                "formattedValue": "18",
                                "value": "18"
                            },
                            "Ship Status": {
                                "formattedValue": "Shipped On Time",
                                "value": "Shipped On Time"
                            },
                            "WEEK(Order Date)": {
                                "formattedValue": "29 September 2019",
                                "value": "2019-09-29 00:00:00"
                            },
                            "YEAR(Order Date)": {
                                "formattedValue": "2019",
                                "value": "2019"
                            }
                        },
                        {
                            "SUM(Number of Records)": {
                                "formattedValue": "17",
                                "value": "17"
                            },
                            "Ship Status": {
                                "formattedValue": "Shipped On Time",
                                "value": "Shipped On Time"
                            },
                            "WEEK(Order Date)": {
                                "formattedValue": "6 October 2019",
                                "value": "2019-10-06 00:00:00"
                            },
                            "YEAR(Order Date)": {
                                "formattedValue": "2019",
                                "value": "2019"
                            }
                        },
                        {
                            "SUM(Number of Records)": {
                                "formattedValue": "7",
                                "value": "7"
                            },
                            "Ship Status": {
                                "formattedValue": "Shipped On Time",
                                "value": "Shipped On Time"
                            },
                            "WEEK(Order Date)": {
                                "formattedValue": "13 October 2019",
                                "value": "2019-10-13 00:00:00"
                            },
                            "YEAR(Order Date)": {
                                "formattedValue": "2019",
                                "value": "2019"
                            }
                        },
                        {
                            "SUM(Number of Records)": {
                                "formattedValue": "30",
                                "value": "30"
                            },
                            "Ship Status": {
                                "formattedValue": "Shipped On Time",
                                "value": "Shipped On Time"
                            },
                            "WEEK(Order Date)": {
                                "formattedValue": "20 October 2019",
                                "value": "2019-10-20 00:00:00"
                            },
                            "YEAR(Order Date)": {
                                "formattedValue": "2019",
                                "value": "2019"
                            }
                        },
                        {
                            "SUM(Number of Records)": {
                                "formattedValue": "52",
                                "value": "52"
                            },
                            "Ship Status": {
                                "formattedValue": "Shipped On Time",
                                "value": "Shipped On Time"
                            },
                            "WEEK(Order Date)": {
                                "formattedValue": "27 October 2019",
                                "value": "2019-10-27 00:00:00"
                            },
                            "YEAR(Order Date)": {
                                "formattedValue": "2019",
                                "value": "2019"
                            }
                        },
                        {
                            "SUM(Number of Records)": {
                                "formattedValue": "35",
                                "value": "35"
                            },
                            "Ship Status": {
                                "formattedValue": "Shipped On Time",
                                "value": "Shipped On Time"
                            },
                            "WEEK(Order Date)": {
                                "formattedValue": "3 November 2019",
                                "value": "2019-11-03 00:00:00"
                            },
                            "YEAR(Order Date)": {
                                "formattedValue": "2019",
                                "value": "2019"
                            }
                        },
                        {
                            "SUM(Number of Records)": {
                                "formattedValue": "44",
                                "value": "44"
                            },
                            "Ship Status": {
                                "formattedValue": "Shipped On Time",
                                "value": "Shipped On Time"
                            },
                            "WEEK(Order Date)": {
                                "formattedValue": "10 November 2019",
                                "value": "2019-11-10 00:00:00"
                            },
                            "YEAR(Order Date)": {
                                "formattedValue": "2019",
                                "value": "2019"
                            }
                        },
                        {
                            "SUM(Number of Records)": {
                                "formattedValue": "34",
                                "value": "34"
                            },
                            "Ship Status": {
                                "formattedValue": "Shipped On Time",
                                "value": "Shipped On Time"
                            },
                            "WEEK(Order Date)": {
                                "formattedValue": "17 November 2019",
                                "value": "2019-11-17 00:00:00"
                            },
                            "YEAR(Order Date)": {
                                "formattedValue": "2019",
                                "value": "2019"
                            }
                        },
                        {
                            "SUM(Number of Records)": {
                                "formattedValue": "23",
                                "value": "23"
                            },
                            "Ship Status": {
                                "formattedValue": "Shipped On Time",
                                "value": "Shipped On Time"
                            },
                            "WEEK(Order Date)": {
                                "formattedValue": "24 November 2019",
                                "value": "2019-11-24 00:00:00"
                            },
                            "YEAR(Order Date)": {
                                "formattedValue": "2019",
                                "value": "2019"
                            }
                        },
                        {
                            "SUM(Number of Records)": {
                                "formattedValue": "58",
                                "value": "58"
                            },
                            "Ship Status": {
                                "formattedValue": "Shipped On Time",
                                "value": "Shipped On Time"
                            },
                            "WEEK(Order Date)": {
                                "formattedValue": "1 December 2019",
                                "value": "2019-12-01 00:00:00"
                            },
                            "YEAR(Order Date)": {
                                "formattedValue": "2019",
                                "value": "2019"
                            }
                        },
                        {
                            "SUM(Number of Records)": {
                                "formattedValue": "46",
                                "value": "46"
                            },
                            "Ship Status": {
                                "formattedValue": "Shipped On Time",
                                "value": "Shipped On Time"
                            },
                            "WEEK(Order Date)": {
                                "formattedValue": "8 December 2019",
                                "value": "2019-12-08 00:00:00"
                            },
                            "YEAR(Order Date)": {
                                "formattedValue": "2019",
                                "value": "2019"
                            }
                        },
                        {
                            "SUM(Number of Records)": {
                                "formattedValue": "21",
                                "value": "21"
                            },
                            "Ship Status": {
                                "formattedValue": "Shipped On Time",
                                "value": "Shipped On Time"
                            },
                            "WEEK(Order Date)": {
                                "formattedValue": "15 December 2019",
                                "value": "2019-12-15 00:00:00"
                            },
                            "YEAR(Order Date)": {
                                "formattedValue": "2019",
                                "value": "2019"
                            }
                        },
                        {
                            "SUM(Number of Records)": {
                                "formattedValue": "39",
                                "value": "39"
                            },
                            "Ship Status": {
                                "formattedValue": "Shipped On Time",
                                "value": "Shipped On Time"
                            },
                            "WEEK(Order Date)": {
                                "formattedValue": "22 December 2019",
                                "value": "2019-12-22 00:00:00"
                            },
                            "YEAR(Order Date)": {
                                "formattedValue": "2019",
                                "value": "2019"
                            }
                        },
                        {
                            "SUM(Number of Records)": {
                                "formattedValue": "7",
                                "value": "7"
                            },
                            "Ship Status": {
                                "formattedValue": "Shipped On Time",
                                "value": "Shipped On Time"
                            },
                            "WEEK(Order Date)": {
                                "formattedValue": "29 December 2019",
                                "value": "2019-12-29 00:00:00"
                            },
                            "YEAR(Order Date)": {
                                "formattedValue": "2019",
                                "value": "2019"
                            }
                        },
                        {
                            "SUM(Number of Records)": {
                                "formattedValue": "18",
                                "value": "18"
                            },
                            "Ship Status": {
                                "formattedValue": "Shipped Late",
                                "value": "Shipped Late"
                            },
                            "WEEK(Order Date)": {
                                "formattedValue": "29 September 2019",
                                "value": "2019-09-29 00:00:00"
                            },
                            "YEAR(Order Date)": {
                                "formattedValue": "2019",
                                "value": "2019"
                            }
                        },
                        {
                            "SUM(Number of Records)": {
                                "formattedValue": "7",
                                "value": "7"
                            },
                            "Ship Status": {
                                "formattedValue": "Shipped Late",
                                "value": "Shipped Late"
                            },
                            "WEEK(Order Date)": {
                                "formattedValue": "6 October 2019",
                                "value": "2019-10-06 00:00:00"
                            },
                            "YEAR(Order Date)": {
                                "formattedValue": "2019",
                                "value": "2019"
                            }
                        },
                        {
                            "SUM(Number of Records)": {
                                "formattedValue": "34",
                                "value": "34"
                            },
                            "Ship Status": {
                                "formattedValue": "Shipped Late",
                                "value": "Shipped Late"
                            },
                            "WEEK(Order Date)": {
                                "formattedValue": "13 October 2019",
                                "value": "2019-10-13 00:00:00"
                            },
                            "YEAR(Order Date)": {
                                "formattedValue": "2019",
                                "value": "2019"
                            }
                        },
                        {
                            "SUM(Number of Records)": {
                                "formattedValue": "17",
                                "value": "17"
                            },
                            "Ship Status": {
                                "formattedValue": "Shipped Late",
                                "value": "Shipped Late"
                            },
                            "WEEK(Order Date)": {
                                "formattedValue": "20 October 2019",
                                "value": "2019-10-20 00:00:00"
                            },
                            "YEAR(Order Date)": {
                                "formattedValue": "2019",
                                "value": "2019"
                            }
                        },
                        {
                            "SUM(Number of Records)": {
                                "formattedValue": "22",
                                "value": "22"
                            },
                            "Ship Status": {
                                "formattedValue": "Shipped Late",
                                "value": "Shipped Late"
                            },
                            "WEEK(Order Date)": {
                                "formattedValue": "27 October 2019",
                                "value": "2019-10-27 00:00:00"
                            },
                            "YEAR(Order Date)": {
                                "formattedValue": "2019",
                                "value": "2019"
                            }
                        },
                        {
                            "SUM(Number of Records)": {
                                "formattedValue": "31",
                                "value": "31"
                            },
                            "Ship Status": {
                                "formattedValue": "Shipped Late",
                                "value": "Shipped Late"
                            },
                            "WEEK(Order Date)": {
                                "formattedValue": "3 November 2019",
                                "value": "2019-11-03 00:00:00"
                            },
                            "YEAR(Order Date)": {
                                "formattedValue": "2019",
                                "value": "2019"
                            }
                        },
                        {
                            "SUM(Number of Records)": {
                                "formattedValue": "45",
                                "value": "45"
                            },
                            "Ship Status": {
                                "formattedValue": "Shipped Late",
                                "value": "Shipped Late"
                            },
                            "WEEK(Order Date)": {
                                "formattedValue": "10 November 2019",
                                "value": "2019-11-10 00:00:00"
                            },
                            "YEAR(Order Date)": {
                                "formattedValue": "2019",
                                "value": "2019"
                            }
                        },
                        {
                            "SUM(Number of Records)": {
                                "formattedValue": "50",
                                "value": "50"
                            },
                            "Ship Status": {
                                "formattedValue": "Shipped Late",
                                "value": "Shipped Late"
                            },
                            "WEEK(Order Date)": {
                                "formattedValue": "17 November 2019",
                                "value": "2019-11-17 00:00:00"
                            },
                            "YEAR(Order Date)": {
                                "formattedValue": "2019",
                                "value": "2019"
                            }
                        },
                        {
                            "SUM(Number of Records)": {
                                "formattedValue": "27",
                                "value": "27"
                            },
                            "Ship Status": {
                                "formattedValue": "Shipped Late",
                                "value": "Shipped Late"
                            },
                            "WEEK(Order Date)": {
                                "formattedValue": "24 November 2019",
                                "value": "2019-11-24 00:00:00"
                            },
                            "YEAR(Order Date)": {
                                "formattedValue": "2019",
                                "value": "2019"
                            }
                        },
                        {
                            "SUM(Number of Records)": {
                                "formattedValue": "41",
                                "value": "41"
                            },
                            "Ship Status": {
                                "formattedValue": "Shipped Late",
                                "value": "Shipped Late"
                            },
                            "WEEK(Order Date)": {
                                "formattedValue": "1 December 2019",
                                "value": "2019-12-01 00:00:00"
                            },
                            "YEAR(Order Date)": {
                                "formattedValue": "2019",
                                "value": "2019"
                            }
                        },
                        {
                            "SUM(Number of Records)": {
                                "formattedValue": "25",
                                "value": "25"
                            },
                            "Ship Status": {
                                "formattedValue": "Shipped Late",
                                "value": "Shipped Late"
                            },
                            "WEEK(Order Date)": {
                                "formattedValue": "8 December 2019",
                                "value": "2019-12-08 00:00:00"
                            },
                            "YEAR(Order Date)": {
                                "formattedValue": "2019",
                                "value": "2019"
                            }
                        },
                        {
                            "SUM(Number of Records)": {
                                "formattedValue": "43",
                                "value": "43"
                            },
                            "Ship Status": {
                                "formattedValue": "Shipped Late",
                                "value": "Shipped Late"
                            },
                            "WEEK(Order Date)": {
                                "formattedValue": "15 December 2019",
                                "value": "2019-12-15 00:00:00"
                            },
                            "YEAR(Order Date)": {
                                "formattedValue": "2019",
                                "value": "2019"
                            }
                        },
                        {
                            "SUM(Number of Records)": {
                                "formattedValue": "56",
                                "value": "56"
                            },
                            "Ship Status": {
                                "formattedValue": "Shipped Late",
                                "value": "Shipped Late"
                            },
                            "WEEK(Order Date)": {
                                "formattedValue": "22 December 2019",
                                "value": "2019-12-22 00:00:00"
                            },
                            "YEAR(Order Date)": {
                                "formattedValue": "2019",
                                "value": "2019"
                            }
                        },
                        {
                            "SUM(Number of Records)": {
                                "formattedValue": "2",
                                "value": "2"
                            },
                            "Ship Status": {
                                "formattedValue": "Shipped Late",
                                "value": "Shipped Late"
                            },
                            "WEEK(Order Date)": {
                                "formattedValue": "29 December 2019",
                                "value": "2019-12-29 00:00:00"
                            },
                            "YEAR(Order Date)": {
                                "formattedValue": "2019",
                                "value": "2019"
                            }
                        }
                    ]
                },
                "filters": [
                    {
                        "caption": "Action (Delayed?)",
                        "type": "categorical",
                        "values": [
                            {
                                "formattedValue": "Shipped Early",
                                "value": "Shipped Early"
                            },
                            {
                                "formattedValue": "Shipped Late",
                                "value": "Shipped Late"
                            },
                            {
                                "formattedValue": "Shipped On Time",
                                "value": "Shipped On Time"
                            }
                        ]
                    },
                    {
                        "caption": "Action (Ship Status)",
                        "type": "categorical",
                        "values": [
                            {
                                "formattedValue": "Shipped Early",
                                "value": "Shipped Early"
                            },
                            {
                                "formattedValue": "Shipped Late",
                                "value": "Shipped Late"
                            },
                            {
                                "formattedValue": "Shipped On Time",
                                "value": "Shipped On Time"
                            }
                        ]
                    },
                    {
                        "caption": "Region",
                        "type": "categorical",
                        "values": [
                            {
                                "formattedValue": "Central",
                                "value": "Central"
                            },
                            {
                                "formattedValue": "East",
                                "value": "East"
                            },
                            {
                                "formattedValue": "South",
                                "value": "South"
                            },
                            {
                                "formattedValue": "West",
                                "value": "West"
                            }
                        ]
                    },
                    {
                        "caption": "Ship Mode",
                        "type": "categorical",
                        "values": [
                            {
                                "formattedValue": "First Class",
                                "value": "First Class"
                            },
                            {
                                "formattedValue": "Same Day",
                                "value": "Same Day"
                            },
                            {
                                "formattedValue": "Second Class",
                                "value": "Second Class"
                            },
                            {
                                "formattedValue": "Standard Class",
                                "value": "Standard Class"
                            }
                        ]
                    },
                    {
                        "caption": "QUARTER(Order Date)",
                        "type": "categorical",
                        "values": [
                            {
                                "formattedValue": "Q4",
                                "value": 4
                            }
                        ]
                    },
                    {
                        "caption": "YEAR(Order Date)",
                        "type": "categorical",
                        "values": [
                            {
                                "formattedValue": "2019",
                                "value": 2019
                            }
                        ]
                    }
                ],
                "name": "ShippingTrend"
            },
            {
                "columns": {
                    "summary": [
                        {
                            "dataType": "string",
                            "index": 0,
                            "name": "Product Name"
                        },
                        {
                            "dataType": "date",
                            "index": 1,
                            "name": "Order Date"
                        },
                        {
                            "dataType": "string",
                            "index": 2,
                            "name": "Customer Name"
                        },
                        {
                            "dataType": "string",
                            "index": 3,
                            "name": "Order ID"
                        },
                        {
                            "dataType": "string",
                            "index": 4,
                            "name": "Ship Mode"
                        },
                        {
                            "dataType": "string",
                            "index": 5,
                            "name": "Ship Status"
                        },
                        {
                            "dataType": "date",
                            "index": 6,
                            "name": "MIN(Order Date)"
                        },
                        {
                            "dataType": "integer",
                            "index": 7,
                            "name": "SUM(Days to Ship Actual)"
                        }
                    ],
                    "underlying": [
                        {
                            "dataType": "string",
                            "index": 0,
                            "name": "Product Name"
                        },
                        {
                            "dataType": "date",
                            "index": 1,
                            "name": "Order Date"
                        },
                        {
                            "dataType": "string",
                            "index": 2,
                            "name": "Customer Name"
                        },
                        {
                            "dataType": "string",
                            "index": 3,
                            "name": "Order ID"
                        },
                        {
                            "dataType": "string",
                            "index": 4,
                            "name": "Ship Mode"
                        },
                        {
                            "dataType": "string",
                            "index": 5,
                            "name": "Ship Status"
                        },
                        {
                            "dataType": "string",
                            "index": 6,
                            "name": "Region"
                        },
                        {
                            "dataType": "date",
                            "index": 7,
                            "name": "Ship Date"
                        },
                        {
                            "dataType": "integer",
                            "index": 8,
                            "name": "Days to Ship Actual"
                        },
                        {
                            "dataType": "integer",
                            "index": 9,
                            "name": "Days to Ship Scheduled"
                        }
                    ]
                },
                "data": {
                    "summary": [
                        {
                            "Customer Name": {
                                "formattedValue": "Gary McGarr",
                                "value": "Gary McGarr"
                            },
                            "MIN(Order Date)": {
                                "formattedValue": "08/10/2019",
                                "value": "2019-10-08"
                            },
                            "Order Date": {
                                "formattedValue": "08/10/2019",
                                "value": "2019-10-08"
                            },
                            "Order ID": {
                                "formattedValue": "US-2019-168613",
                                "value": "US-2019-168613"
                            },
                            "Product Name": {
                                "formattedValue": "Office Star - Ergonomically Designed Knee Chair",
                                "value": "Office Star - Ergonomically Designed Knee Chair"
                            },
                            "SUM(Days to Ship Actual)": {
                                "formattedValue": "6",
                                "value": "6"
                            },
                            "Ship Mode": {
                                "formattedValue": "Standard Class",
                                "value": "Standard Class"
                            },
                            "Ship Status": {
                                "formattedValue": "Shipped On Time",
                                "value": "Shipped On Time"
                            }
                        },
                        {
                            "Customer Name": {
                                "formattedValue": "Grant Thornton",
                                "value": "Grant Thornton"
                            },
                            "MIN(Order Date)": {
                                "formattedValue": "04/11/2019",
                                "value": "2019-11-04"
                            },
                            "Order Date": {
                                "formattedValue": "04/11/2019",
                                "value": "2019-11-04"
                            },
                            "Order ID": {
                                "formattedValue": "US-2019-168116",
                                "value": "US-2019-168116"
                            },
                            "Product Name": {
                                "formattedValue": "Cubify CubeX 3D Printer Triple Head Print",
                                "value": "Cubify CubeX 3D Printer Triple Head Print"
                            },
                            "SUM(Days to Ship Actual)": {
                                "formattedValue": "0",
                                "value": "0"
                            },
                            "Ship Mode": {
                                "formattedValue": "Same Day",
                                "value": "Same Day"
                            },
                            "Ship Status": {
                                "formattedValue": "Shipped On Time",
                                "value": "Shipped On Time"
                            }
                        },
                        {
                            "Customer Name": {
                                "formattedValue": "Grant Thornton",
                                "value": "Grant Thornton"
                            },
                            "MIN(Order Date)": {
                                "formattedValue": "04/11/2019",
                                "value": "2019-11-04"
                            },
                            "Order Date": {
                                "formattedValue": "04/11/2019",
                                "value": "2019-11-04"
                            },
                            "Order ID": {
                                "formattedValue": "US-2019-168116",
                                "value": "US-2019-168116"
                            },
                            "Product Name": {
                                "formattedValue": "Eureka The Boss Plus 12-Amp Hard Box Upright Vacuum, Red",
                                "value": "Eureka The Boss Plus 12-Amp Hard Box Upright Vacuum, Red"
                            },
                            "SUM(Days to Ship Actual)": {
                                "formattedValue": "0",
                                "value": "0"
                            },
                            "Ship Mode": {
                                "formattedValue": "Same Day",
                                "value": "Same Day"
                            },
                            "Ship Status": {
                                "formattedValue": "Shipped On Time",
                                "value": "Shipped On Time"
                            }
                        },
                        {
                            "Customer Name": {
                                "formattedValue": "John Lee",
                                "value": "John Lee"
                            },
                            "MIN(Order Date)": {
                                "formattedValue": "09/12/2019",
                                "value": "2019-12-09"
                            },
                            "Order Date": {
                                "formattedValue": "09/12/2019",
                                "value": "2019-12-09"
                            },
                            "Order ID": {
                                "formattedValue": "US-2019-167920",
                                "value": "US-2019-167920"
                            },
                            "Product Name": {
                                "formattedValue": "XtraLife ClearVue Slant-D Ring Binder, White, 3\"",
                                "value": "XtraLife ClearVue Slant-D Ring Binder, White, 3\""
                            },
                            "SUM(Days to Ship Actual)": {
                                "formattedValue": "3",
                                "value": "3"
                            },
                            "Ship Mode": {
                                "formattedValue": "Second Class",
                                "value": "Second Class"
                            },
                            "Ship Status": {
                                "formattedValue": "Shipped On Time",
                                "value": "Shipped On Time"
                            }
                        },
                        {
                            "Customer Name": {
                                "formattedValue": "John Lee",
                                "value": "John Lee"
                            },
                            "MIN(Order Date)": {
                                "formattedValue": "09/12/2019",
                                "value": "2019-12-09"
                            },
                            "Order Date": {
                                "formattedValue": "09/12/2019",
                                "value": "2019-12-09"
                            },
                            "Order ID": {
                                "formattedValue": "US-2019-167920",
                                "value": "US-2019-167920"
                            },
                            "Product Name": {
                                "formattedValue": "Canon Imageclass D680 Copier / Fax",
                                "value": "Canon Imageclass D680 Copier / Fax"
                            },
                            "SUM(Days to Ship Actual)": {
                                "formattedValue": "3",
                                "value": "3"
                            },
                            "Ship Mode": {
                                "formattedValue": "Second Class",
                                "value": "Second Class"
                            },
                            "Ship Status": {
                                "formattedValue": "Shipped On Time",
                                "value": "Shipped On Time"
                            }
                        },
                        {
                            "Customer Name": {
                                "formattedValue": "John Lee",
                                "value": "John Lee"
                            },
                            "MIN(Order Date)": {
                                "formattedValue": "09/12/2019",
                                "value": "2019-12-09"
                            },
                            "Order Date": {
                                "formattedValue": "09/12/2019",
                                "value": "2019-12-09"
                            },
                            "Order ID": {
                                "formattedValue": "US-2019-167920",
                                "value": "US-2019-167920"
                            },
                            "Product Name": {
                                "formattedValue": "Belkin F9M820V08 8 Outlet Surge",
                                "value": "Belkin F9M820V08 8 Outlet Surge"
                            },
                            "SUM(Days to Ship Actual)": {
                                "formattedValue": "3",
                                "value": "3"
                            },
                            "Ship Mode": {
                                "formattedValue": "Second Class",
                                "value": "Second Class"
                            },
                            "Ship Status": {
                                "formattedValue": "Shipped On Time",
                                "value": "Shipped On Time"
                            }
                        },
                        {
                            "Customer Name": {
                                "formattedValue": "John Lee",
                                "value": "John Lee"
                            },
                            "MIN(Order Date)": {
                                "formattedValue": "09/12/2019",
                                "value": "2019-12-09"
                            },
                            "Order Date": {
                                "formattedValue": "09/12/2019",
                                "value": "2019-12-09"
                            },
                            "Order ID": {
                                "formattedValue": "US-2019-167920",
                                "value": "US-2019-167920"
                            },
                            "Product Name": {
                                "formattedValue": "Avery 492",
                                "value": "Avery 492"
                            },
                            "SUM(Days to Ship Actual)": {
                                "formattedValue": "3",
                                "value": "3"
                            },
                            "Ship Mode": {
                                "formattedValue": "Second Class",
                                "value": "Second Class"
                            },
                            "Ship Status": {
                                "formattedValue": "Shipped On Time",
                                "value": "Shipped On Time"
                            }
                        },
                        {
                            "Customer Name": {
                                "formattedValue": "John Lee",
                                "value": "John Lee"
                            },
                            "MIN(Order Date)": {
                                "formattedValue": "09/12/2019",
                                "value": "2019-12-09"
                            },
                            "Order Date": {
                                "formattedValue": "09/12/2019",
                                "value": "2019-12-09"
                            },
                            "Order ID": {
                                "formattedValue": "US-2019-167920",
                                "value": "US-2019-167920"
                            },
                            "Product Name": {
                                "formattedValue": "Eldon Gobal File Keepers",
                                "value": "Eldon Gobal File Keepers"
                            },
                            "SUM(Days to Ship Actual)": {
                                "formattedValue": "3",
                                "value": "3"
                            },
                            "Ship Mode": {
                                "formattedValue": "Second Class",
                                "value": "Second Class"
                            },
                            "Ship Status": {
                                "formattedValue": "Shipped On Time",
                                "value": "Shipped On Time"
                            }
                        },
                        {
                            "Customer Name": {
                                "formattedValue": "John Lee",
                                "value": "John Lee"
                            },
                            "MIN(Order Date)": {
                                "formattedValue": "09/12/2019",
                                "value": "2019-12-09"
                            },
                            "Order Date": {
                                "formattedValue": "09/12/2019",
                                "value": "2019-12-09"
                            },
                            "Order ID": {
                                "formattedValue": "US-2019-167920",
                                "value": "US-2019-167920"
                            },
                            "Product Name": {
                                "formattedValue": "Avery Durable Slant Ring Binders, No Labels",
                                "value": "Avery Durable Slant Ring Binders, No Labels"
                            },
                            "SUM(Days to Ship Actual)": {
                                "formattedValue": "3",
                                "value": "3"
                            },
                            "Ship Mode": {
                                "formattedValue": "Second Class",
                                "value": "Second Class"
                            },
                            "Ship Status": {
                                "formattedValue": "Shipped On Time",
                                "value": "Shipped On Time"
                            }
                        },
                        {
                            "Customer Name": {
                                "formattedValue": "John Lee",
                                "value": "John Lee"
                            },
                            "MIN(Order Date)": {
                                "formattedValue": "09/12/2019",
                                "value": "2019-12-09"
                            },
                            "Order Date": {
                                "formattedValue": "09/12/2019",
                                "value": "2019-12-09"
                            },
                            "Order ID": {
                                "formattedValue": "US-2019-167920",
                                "value": "US-2019-167920"
                            },
                            "Product Name": {
                                "formattedValue": "Logitech ClearChat Comfort/USB Headset H390",
                                "value": "Logitech ClearChat Comfort/USB Headset H390"
                            },
                            "SUM(Days to Ship Actual)": {
                                "formattedValue": "3",
                                "value": "3"
                            },
                            "Ship Mode": {
                                "formattedValue": "Second Class",
                                "value": "Second Class"
                            },
                            "Ship Status": {
                                "formattedValue": "Shipped On Time",
                                "value": "Shipped On Time"
                            }
                        },
                        {
                            "Customer Name": {
                                "formattedValue": "Pamela Coakley",
                                "value": "Pamela Coakley"
                            },
                            "MIN(Order Date)": {
                                "formattedValue": "28/12/2019",
                                "value": "2019-12-28"
                            },
                            "Order Date": {
                                "formattedValue": "28/12/2019",
                                "value": "2019-12-28"
                            },
                            "Order ID": {
                                "formattedValue": "US-2019-162068",
                                "value": "US-2019-162068"
                            },
                            "Product Name": {
                                "formattedValue": "Avery Reinforcements for Hole-Punch Pages",
                                "value": "Avery Reinforcements for Hole-Punch Pages"
                            },
                            "SUM(Days to Ship Actual)": {
                                "formattedValue": "3",
                                "value": "3"
                            },
                            "Ship Mode": {
                                "formattedValue": "Second Class",
                                "value": "Second Class"
                            },
                            "Ship Status": {
                                "formattedValue": "Shipped On Time",
                                "value": "Shipped On Time"
                            }
                        },
                        {
                            "Customer Name": {
                                "formattedValue": "Brian Thompson",
                                "value": "Brian Thompson"
                            },
                            "MIN(Order Date)": {
                                "formattedValue": "20/11/2019",
                                "value": "2019-11-20"
                            },
                            "Order Date": {
                                "formattedValue": "20/11/2019",
                                "value": "2019-11-20"
                            },
                            "Order ID": {
                                "formattedValue": "US-2019-161193",
                                "value": "US-2019-161193"
                            },
                            "Product Name": {
                                "formattedValue": "GE General Purpose, Extra Long Life, Showcase & Floodlight Incandescent Bulbs",
                                "value": "GE General Purpose, Extra Long Life, Showcase & Floodlight Incandescent Bulbs"
                            },
                            "SUM(Days to Ship Actual)": {
                                "formattedValue": "6",
                                "value": "6"
                            },
                            "Ship Mode": {
                                "formattedValue": "Standard Class",
                                "value": "Standard Class"
                            },
                            "Ship Status": {
                                "formattedValue": "Shipped On Time",
                                "value": "Shipped On Time"
                            }
                        },
                        {
                            "Customer Name": {
                                "formattedValue": "Brian Thompson",
                                "value": "Brian Thompson"
                            },
                            "MIN(Order Date)": {
                                "formattedValue": "20/11/2019",
                                "value": "2019-11-20"
                            },
                            "Order Date": {
                                "formattedValue": "20/11/2019",
                                "value": "2019-11-20"
                            },
                            "Order ID": {
                                "formattedValue": "US-2019-161193",
                                "value": "US-2019-161193"
                            },
                            "Product Name": {
                                "formattedValue": "Floodlight Indoor Halogen Bulbs, 1 Bulb per Pack, 60 Watts",
                                "value": "Floodlight Indoor Halogen Bulbs, 1 Bulb per Pack, 60 Watts"
                            },
                            "SUM(Days to Ship Actual)": {
                                "formattedValue": "6",
                                "value": "6"
                            },
                            "Ship Mode": {
                                "formattedValue": "Standard Class",
                                "value": "Standard Class"
                            },
                            "Ship Status": {
                                "formattedValue": "Shipped On Time",
                                "value": "Shipped On Time"
                            }
                        },
                        {
                            "Customer Name": {
                                "formattedValue": "Arianne Irving",
                                "value": "Arianne Irving"
                            },
                            "MIN(Order Date)": {
                                "formattedValue": "11/12/2019",
                                "value": "2019-12-11"
                            },
                            "Order Date": {
                                "formattedValue": "11/12/2019",
                                "value": "2019-12-11"
                            },
                            "Order ID": {
                                "formattedValue": "US-2019-160759",
                                "value": "US-2019-160759"
                            },
                            "Product Name": {
                                "formattedValue": "Leather Task Chair, Black",
                                "value": "Leather Task Chair, Black"
                            },
                            "SUM(Days to Ship Actual)": {
                                "formattedValue": "6",
                                "value": "6"
                            },
                            "Ship Mode": {
                                "formattedValue": "Standard Class",
                                "value": "Standard Class"
                            },
                            "Ship Status": {
                                "formattedValue": "Shipped On Time",
                                "value": "Shipped On Time"
                            }
                        },
                        {
                            "Customer Name": {
                                "formattedValue": "Katherine Hughes",
                                "value": "Katherine Hughes"
                            },
                            "MIN(Order Date)": {
                                "formattedValue": "29/12/2019",
                                "value": "2019-12-29"
                            },
                            "Order Date": {
                                "formattedValue": "29/12/2019",
                                "value": "2019-12-29"
                            },
                            "Order ID": {
                                "formattedValue": "US-2019-158526",
                                "value": "US-2019-158526"
                            },
                            "Product Name": {
                                "formattedValue": "Panasonic KP-350BK Electric Pencil Sharpener with Auto Stop",
                                "value": "Panasonic KP-350BK Electric Pencil Sharpener with Auto Stop"
                            },
                            "SUM(Days to Ship Actual)": {
                                "formattedValue": "3",
                                "value": "3"
                            },
                            "Ship Mode": {
                                "formattedValue": "Second Class",
                                "value": "Second Class"
                            },
                            "Ship Status": {
                                "formattedValue": "Shipped On Time",
                                "value": "Shipped On Time"
                            }
                        },
                        {
                            "Customer Name": {
                                "formattedValue": "Katherine Hughes",
                                "value": "Katherine Hughes"
                            },
                            "MIN(Order Date)": {
                                "formattedValue": "29/12/2019",
                                "value": "2019-12-29"
                            },
                            "Order Date": {
                                "formattedValue": "29/12/2019",
                                "value": "2019-12-29"
                            },
                            "Order ID": {
                                "formattedValue": "US-2019-158526",
                                "value": "US-2019-158526"
                            },
                            "Product Name": {
                                "formattedValue": "Harbour Creations Steel Folding Chair",
                                "value": "Harbour Creations Steel Folding Chair"
                            },
                            "SUM(Days to Ship Actual)": {
                                "formattedValue": "3",
                                "value": "3"
                            },
                            "Ship Mode": {
                                "formattedValue": "Second Class",
                                "value": "Second Class"
                            },
                            "Ship Status": {
                                "formattedValue": "Shipped On Time",
                                "value": "Shipped On Time"
                            }
                        },
                        {
                            "Customer Name": {
                                "formattedValue": "Katherine Hughes",
                                "value": "Katherine Hughes"
                            },
                            "MIN(Order Date)": {
                                "formattedValue": "29/12/2019",
                                "value": "2019-12-29"
                            },
                            "Order Date": {
                                "formattedValue": "29/12/2019",
                                "value": "2019-12-29"
                            },
                            "Order ID": {
                                "formattedValue": "US-2019-158526",
                                "value": "US-2019-158526"
                            },
                            "Product Name": {
                                "formattedValue": "Global Leather and Oak Executive Chair, Black",
                                "value": "Global Leather and Oak Executive Chair, Black"
                            },
                            "SUM(Days to Ship Actual)": {
                                "formattedValue": "3",
                                "value": "3"
                            },
                            "Ship Mode": {
                                "formattedValue": "Second Class",
                                "value": "Second Class"
                            },
                            "Ship Status": {
                                "formattedValue": "Shipped On Time",
                                "value": "Shipped On Time"
                            }
                        },
                        {
                            "Customer Name": {
                                "formattedValue": "Katherine Hughes",
                                "value": "Katherine Hughes"
                            },
                            "MIN(Order Date)": {
                                "formattedValue": "29/12/2019",
                                "value": "2019-12-29"
                            },
                            "Order Date": {
                                "formattedValue": "29/12/2019",
                                "value": "2019-12-29"
                            },
                            "Order ID": {
                                "formattedValue": "US-2019-158526",
                                "value": "US-2019-158526"
                            },
                            "Product Name": {
                                "formattedValue": "GBC ProClick Spines for 32-Hole Punch",
                                "value": "GBC ProClick Spines for 32-Hole Punch"
                            },
                            "SUM(Days to Ship Actual)": {
                                "formattedValue": "3",
                                "value": "3"
                            },
                            "Ship Mode": {
                                "formattedValue": "Second Class",
                                "value": "Second Class"
                            },
                            "Ship Status": {
                                "formattedValue": "Shipped On Time",
                                "value": "Shipped On Time"
                            }
                        },
                        {
                            "Customer Name": {
                                "formattedValue": "Katherine Hughes",
                                "value": "Katherine Hughes"
                            },
                            "MIN(Order Date)": {
                                "formattedValue": "29/12/2019",
                                "value": "2019-12-29"
                            },
                            "Order Date": {
                                "formattedValue": "29/12/2019",
                                "value": "2019-12-29"
                            },
                            "Order ID": {
                                "formattedValue": "US-2019-158526",
                                "value": "US-2019-158526"
                            },
                            "Product Name": {
                                "formattedValue": "DMI Arturo Collection Mission-style Design Wood Chair",
                                "value": "DMI Arturo Collection Mission-style Design Wood Chair"
                            },
                            "SUM(Days to Ship Actual)": {
                                "formattedValue": "3",
                                "value": "3"
                            },
                            "Ship Mode": {
                                "formattedValue": "Second Class",
                                "value": "Second Class"
                            },
                            "Ship Status": {
                                "formattedValue": "Shipped On Time",
                                "value": "Shipped On Time"
                            }
                        },
                        {
                            "Customer Name": {
                                "formattedValue": "Christy Brittain",
                                "value": "Christy Brittain"
                            },
                            "MIN(Order Date)": {
                                "formattedValue": "16/11/2019",
                                "value": "2019-11-16"
                            },
                            "Order Date": {
                                "formattedValue": "16/11/2019",
                                "value": "2019-11-16"
                            },
                            "Order ID": {
                                "formattedValue": "US-2019-157896",
                                "value": "US-2019-157896"
                            },
                            "Product Name": {
                                "formattedValue": "Tops Green Bar Computer Printout Paper",
                                "value": "Tops Green Bar Computer Printout Paper"
                            },
                            "SUM(Days to Ship Actual)": {
                                "formattedValue": "0",
                                "value": "0"
                            },
                            "Ship Mode": {
                                "formattedValue": "Same Day",
                                "value": "Same Day"
                            },
                            "Ship Status": {
                                "formattedValue": "Shipped On Time",
                                "value": "Shipped On Time"
                            }
                        },
                        {
                            "Customer Name": {
                                "formattedValue": "Ann Blume",
                                "value": "Ann Blume"
                            },
                            "MIN(Order Date)": {
                                "formattedValue": "10/11/2019",
                                "value": "2019-11-10"
                            },
                            "Order Date": {
                                "formattedValue": "10/11/2019",
                                "value": "2019-11-10"
                            },
                            "Order ID": {
                                "formattedValue": "US-2019-155425",
                                "value": "US-2019-155425"
                            },
                            "Product Name": {
                                "formattedValue": "Case Logic 2.4GHz Wireless Keyboard",
                                "value": "Case Logic 2.4GHz Wireless Keyboard"
                            },
                            "SUM(Days to Ship Actual)": {
                                "formattedValue": "1",
                                "value": "1"
                            },
                            "Ship Mode": {
                                "formattedValue": "First Class",
                                "value": "First Class"
                            },
                            "Ship Status": {
                                "formattedValue": "Shipped On Time",
                                "value": "Shipped On Time"
                            }
                        },
                        {
                            "Customer Name": {
                                "formattedValue": "Ann Blume",
                                "value": "Ann Blume"
                            },
                            "MIN(Order Date)": {
                                "formattedValue": "10/11/2019",
                                "value": "2019-11-10"
                            },
                            "Order Date": {
                                "formattedValue": "10/11/2019",
                                "value": "2019-11-10"
                            },
                            "Order ID": {
                                "formattedValue": "US-2019-155425",
                                "value": "US-2019-155425"
                            },
                            "Product Name": {
                                "formattedValue": "Cardinal EasyOpen D-Ring Binders",
                                "value": "Cardinal EasyOpen D-Ring Binders"
                            },
                            "SUM(Days to Ship Actual)": {
                                "formattedValue": "1",
                                "value": "1"
                            },
                            "Ship Mode": {
                                "formattedValue": "First Class",
                                "value": "First Class"
                            },
                            "Ship Status": {
                                "formattedValue": "Shipped On Time",
                                "value": "Shipped On Time"
                            }
                        },
                        {
                            "Customer Name": {
                                "formattedValue": "Ann Blume",
                                "value": "Ann Blume"
                            },
                            "MIN(Order Date)": {
                                "formattedValue": "10/11/2019",
                                "value": "2019-11-10"
                            },
                            "Order Date": {
                                "formattedValue": "10/11/2019",
                                "value": "2019-11-10"
                            },
                            "Order ID": {
                                "formattedValue": "US-2019-155425",
                                "value": "US-2019-155425"
                            },
                            "Product Name": {
                                "formattedValue": "DYMO CardScan Personal V9 Business Card Scanner",
                                "value": "DYMO CardScan Personal V9 Business Card Scanner"
                            },
                            "SUM(Days to Ship Actual)": {
                                "formattedValue": "1",
                                "value": "1"
                            },
                            "Ship Mode": {
                                "formattedValue": "First Class",
                                "value": "First Class"
                            },
                            "Ship Status": {
                                "formattedValue": "Shipped On Time",
                                "value": "Shipped On Time"
                            }
                        },
                        {
                            "Customer Name": {
                                "formattedValue": "Ann Blume",
                                "value": "Ann Blume"
                            },
                            "MIN(Order Date)": {
                                "formattedValue": "10/11/2019",
                                "value": "2019-11-10"
                            },
                            "Order Date": {
                                "formattedValue": "10/11/2019",
                                "value": "2019-11-10"
                            },
                            "Order ID": {
                                "formattedValue": "US-2019-155425",
                                "value": "US-2019-155425"
                            },
                            "Product Name": {
                                "formattedValue": "Adtran 1202752G1",
                                "value": "Adtran 1202752G1"
                            },
                            "SUM(Days to Ship Actual)": {
                                "formattedValue": "1",
                                "value": "1"
                            },
                            "Ship Mode": {
                                "formattedValue": "First Class",
                                "value": "First Class"
                            },
                            "Ship Status": {
                                "formattedValue": "Shipped On Time",
                                "value": "Shipped On Time"
                            }
                        },
                        {
                            "Customer Name": {
                                "formattedValue": "Ann Blume",
                                "value": "Ann Blume"
                            },
                            "MIN(Order Date)": {
                                "formattedValue": "10/11/2019",
                                "value": "2019-11-10"
                            },
                            "Order Date": {
                                "formattedValue": "10/11/2019",
                                "value": "2019-11-10"
                            },
                            "Order ID": {
                                "formattedValue": "US-2019-155425",
                                "value": "US-2019-155425"
                            },
                            "Product Name": {
                                "formattedValue": "Hon 2090 Pillow Soft Series Mid Back Swivel/Tilt Chairs",
                                "value": "Hon 2090 Pillow Soft Series Mid Back Swivel/Tilt Chairs"
                            },
                            "SUM(Days to Ship Actual)": {
                                "formattedValue": "1",
                                "value": "1"
                            },
                            "Ship Mode": {
                                "formattedValue": "First Class",
                                "value": "First Class"
                            },
                            "Ship Status": {
                                "formattedValue": "Shipped On Time",
                                "value": "Shipped On Time"
                            }
                        },
                        {
                            "Customer Name": {
                                "formattedValue": "Frank Merwin",
                                "value": "Frank Merwin"
                            },
                            "MIN(Order Date)": {
                                "formattedValue": "06/11/2019",
                                "value": "2019-11-06"
                            },
                            "Order Date": {
                                "formattedValue": "06/11/2019",
                                "value": "2019-11-06"
                            },
                            "Order ID": {
                                "formattedValue": "US-2019-153948",
                                "value": "US-2019-153948"
                            },
                            "Product Name": {
                                "formattedValue": "Kingston Digital DataTraveler 32GB USB 2.0",
                                "value": "Kingston Digital DataTraveler 32GB USB 2.0"
                            },
                            "SUM(Days to Ship Actual)": {
                                "formattedValue": "0",
                                "value": "0"
                            },
                            "Ship Mode": {
                                "formattedValue": "Same Day",
                                "value": "Same Day"
                            },
                            "Ship Status": {
                                "formattedValue": "Shipped On Time",
                                "value": "Shipped On Time"
                            }
                        },
                        {
                            "Customer Name": {
                                "formattedValue": "Frank Merwin",
                                "value": "Frank Merwin"
                            },
                            "MIN(Order Date)": {
                                "formattedValue": "06/11/2019",
                                "value": "2019-11-06"
                            },
                            "Order Date": {
                                "formattedValue": "06/11/2019",
                                "value": "2019-11-06"
                            },
                            "Order ID": {
                                "formattedValue": "US-2019-153948",
                                "value": "US-2019-153948"
                            },
                            "Product Name": {
                                "formattedValue": "Avery 503",
                                "value": "Avery 503"
                            },
                            "SUM(Days to Ship Actual)": {
                                "formattedValue": "0",
                                "value": "0"
                            },
                            "Ship Mode": {
                                "formattedValue": "Same Day",
                                "value": "Same Day"
                            },
                            "Ship Status": {
                                "formattedValue": "Shipped On Time",
                                "value": "Shipped On Time"
                            }
                        },
                        {
                            "Customer Name": {
                                "formattedValue": "Frank Merwin",
                                "value": "Frank Merwin"
                            },
                            "MIN(Order Date)": {
                                "formattedValue": "06/11/2019",
                                "value": "2019-11-06"
                            },
                            "Order Date": {
                                "formattedValue": "06/11/2019",
                                "value": "2019-11-06"
                            },
                            "Order ID": {
                                "formattedValue": "US-2019-153948",
                                "value": "US-2019-153948"
                            },
                            "Product Name": {
                                "formattedValue": "Astroparche Fine Business Paper",
                                "value": "Astroparche Fine Business Paper"
                            },
                            "SUM(Days to Ship Actual)": {
                                "formattedValue": "0",
                                "value": "0"
                            },
                            "Ship Mode": {
                                "formattedValue": "Same Day",
                                "value": "Same Day"
                            },
                            "Ship Status": {
                                "formattedValue": "Shipped On Time",
                                "value": "Shipped On Time"
                            }
                        },
                        {
                            "Customer Name": {
                                "formattedValue": "Frank Merwin",
                                "value": "Frank Merwin"
                            },
                            "MIN(Order Date)": {
                                "formattedValue": "06/11/2019",
                                "value": "2019-11-06"
                            },
                            "Order Date": {
                                "formattedValue": "06/11/2019",
                                "value": "2019-11-06"
                            },
                            "Order ID": {
                                "formattedValue": "US-2019-153948",
                                "value": "US-2019-153948"
                            },
                            "Product Name": {
                                "formattedValue": "Xerox 191",
                                "value": "Xerox 191"
                            },
                            "SUM(Days to Ship Actual)": {
                                "formattedValue": "0",
                                "value": "0"
                            },
                            "Ship Mode": {
                                "formattedValue": "Same Day",
                                "value": "Same Day"
                            },
                            "Ship Status": {
                                "formattedValue": "Shipped On Time",
                                "value": "Shipped On Time"
                            }
                        },
                        {
                            "Customer Name": {
                                "formattedValue": "Frank Merwin",
                                "value": "Frank Merwin"
                            },
                            "MIN(Order Date)": {
                                "formattedValue": "06/11/2019",
                                "value": "2019-11-06"
                            },
                            "Order Date": {
                                "formattedValue": "06/11/2019",
                                "value": "2019-11-06"
                            },
                            "Order ID": {
                                "formattedValue": "US-2019-153948",
                                "value": "US-2019-153948"
                            },
                            "Product Name": {
                                "formattedValue": "Easy-staple paper",
                                "value": "Easy-staple paper"
                            },
                            "SUM(Days to Ship Actual)": {
                                "formattedValue": "0",
                                "value": "0"
                            },
                            "Ship Mode": {
                                "formattedValue": "Same Day",
                                "value": "Same Day"
                            },
                            "Ship Status": {
                                "formattedValue": "Shipped On Time",
                                "value": "Shipped On Time"
                            }
                        },
                        {
                            "Customer Name": {
                                "formattedValue": "Ken Lonsdale",
                                "value": "Ken Lonsdale"
                            },
                            "MIN(Order Date)": {
                                "formattedValue": "13/11/2019",
                                "value": "2019-11-13"
                            },
                            "Order Date": {
                                "formattedValue": "13/11/2019",
                                "value": "2019-11-13"
                            },
                            "Order ID": {
                                "formattedValue": "US-2019-140312",
                                "value": "US-2019-140312"
                            },
                            "Product Name": {
                                "formattedValue": "Samsung Replacement EH64AVFWE Premium Headset",
                                "value": "Samsung Replacement EH64AVFWE Premium Headset"
